{
  "meta": {
    "topic": "AI是否会降低人的创造力？",
    "side_A": "反方",
    "side_B": "正方",
    "version": 4,
    "current_speaker": "A",
    "turn_index": 3,
    "completed_units": 0,
    "technical_stop": false,
    "created_at": "2026-09-13T04:11:59Z",
    "unit_internal_index": 3
  },
  "public_transcript": [
    {
      "event_id": "OPEN-1815bda0",
      "public_version_before": 0,
      "speaker": "A",
      "text": "我的核心判断是：AI 并不会降低人的创造力，反而会抬高创造的下限，把人从重复劳动里解放出来，让真正的创造力——也就是提出新问题、做出新取舍、承担审美与价值判断的那部分——变得更稀缺、也更值钱。\n\n我愿意被抓住的一点是：创造力从来不是\"一个人从零凭空生成\"的东西，它始终依赖工具和既有材料。AI 只是把这种依赖变得更快、更便宜，它没有改变\"选择比生成更接近创造\"这个根本结构。\n\n所以如果 AI 真的在降低什么，降低的也只是那些本来就不算创造的\"机械填充\"成本，而不是创造力本身。",
      "event_time": "2026-09-13T04:12:07Z"
    },
    {
      "event_id": "OPEN-8e0af285",
      "public_version_before": 1,
      "speaker": "B",
      "text": "你最后那句话其实比你想的更有杀伤力，只是方向反了。\n\n你说\"选择比生成更接近创造\"，又说 AI 只是让\"生成\"更快更便宜。那我顺着问一句：人做选择的能力，是从哪练出来的？不是凭空来的，是你在一次次亲自生成、亲自写坏、亲自画砸、亲自走进死胡同又折返的过程里，慢慢长出对好坏的那点判断力的。你省掉的那部分，你管它叫\"机械填充\"，但生成的过程从来不只是填充——它同时是训练你判断力的那个练习场。\n\n工具和 AI 的区别恰恰在这里。笔、画布、软件，都要求你先有想法、先动手，它们不替你出方案。AI 不一样，它把一整套候选直接端到你面前，你只需要点头或摇头。表面上是把你抬高到\"决策者\"的位置，实际上是把\"你得先想、先做、先错\"这个最锻炼创造力的环节整个抽走了。你以为省下的是重复劳动，可省下的其实是练习。\n\n一个不亲自动手生成的人，时间久了，连该选哪个都选不准。",
      "event_time": "2026-09-13T04:12:19Z"
    },
    {
      "event_id": "EV-001-8d3ddcd0",
      "public_version_before": 2,
      "speaker": "A",
      "text": "你把我说的\"生成\"悄悄换成了\"判断力的唯一来源\"。这一换，整条因果链就靠它撑着了，但它撑不住。\n\n判断力不是只能从\"自己亲手生成\"里长出来。恰恰相反，这世界上判断力最强的一批人，大多不是生成者——乐评人不写曲子，编辑不写书，策展人不画画，导演不自己扛摄影机。他们凭什么比创作者更会判断好坏？凭的是他们判断了海量的别人的作品，练出的是\"鉴别\"这一种肌肉，而不是\"生产\"那一种。判断力和生成力，是两条可以分开练的线路。\n\n所以你那句\"不亲自动手生成，连该选哪个都选不准\"，是个没证据的经验断言，而且反例就在眼前：一个每天刷几百张别人画作的策展人，和一个月画十张的人比，谁更能挑出那张好的？大概率是前者。\n\n再退一步说，你说 AI 让人\"只需要点头或摇头\"。可真实使用 AI 的人不是这样——他是提出方向、给条件、看结果、不满意再改、再推翻。这一整套\"试、错、折返\"并没有被抽走，它只是换了个速度发生。被抽走的，只有\"把坏结果亲手做出来\"这个环节；而判断它坏不坏、要不要改，这个环节还在，甚至被要求得更紧了——因为现在你的判断要跑得过机器生成的速度。\n\n真正会退化的，是那些本来就打算什么都不想、直接收下第一个结果的人。可那种人，在 AI 之前也不会有什么创造力。",
      "event_time": "2026-09-13T04:12:31Z"
    },
    {
      "event_id": "EV-001-84c22417",
      "public_version_before": 3,
      "speaker": "B",
      "text": "你说\"试错没被抽走，只是换了个速度\"。这句话其实把我要的论证自己递过来了——问题恰恰就出在\"速度\"上，不在次数上。\n\n判断力不是靠\"试得够多\"长出来的，是靠\"错的代价\"长出来的。你亲手写坏一版，改了三天，最后发现这条路根本不通，这个\"通不通\"的结论才刻进你脑子里。当折返变得零延迟、零成本，你三秒钟就试了下一条路，前一秒那个错还没来得及疼，就已经被你忘了。试错还在，但试错的教训没有了。你要的肌肉是\"吃过亏之后的那点手感\"，不是\"翻页翻得快\"。\n\n至于你举的乐评人、编辑、策展人——他们确实不生成，但他们的鉴别力是在一个前提上练出来的：有人源源不断地生成新鲜、粗糙、会出错的东西给他们鉴。他们的\"第二条线\"，靠\"第一条线\"活着。如果人人都只做点头摇头的决策者，谁来生成那些值得被鉴别的、真正新的东西？鉴别的对象先没了，鉴别这条肌肉也就没了饲料。\n\n所以不是\"判断力和生成力可以分开练\"这么干净——是生成这条线一旦被外包，鉴别这条线也跟着饿死。",
      "event_time": "2026-09-13T04:12:49Z"
    }
  ],
  "definitions": [],
  "standards": [],
  "commitments": [
    {
      "speaker": "A",
      "text": "我的核心判断是：AI 并不会降低人的创造力，反而会抬高创造的下限，把人从重复劳动里解放出来，让真正的创造力——也就是提出新问题、做出新取舍、承担审美与价值判断的那部分——变得更稀缺、也更值钱。 我愿意被抓住的一点是：创造力从来不是\"一个人从零凭空生成\"的东西，它始终依赖工具和既有材料。AI 只是把这种依赖变得更快、更便宜，它没有改变\"选择比生成更接近创造\"这个根本结构。 所以如果 AI 真的在降低什么，降低的也只是那些本来就不算创造的\"机械填充\"成本，而不是创造力本身。",
      "marker": "所以",
      "status": "public_claim"
    },
    {
      "speaker": "A",
      "text": "你把我说的\"生成\"悄悄换成了\"判断力的唯一来源\"。这一换，整条因果链就靠它撑着了，但它撑不住。 判断力不是只能从\"自己亲手生成\"里长出来。恰恰相反，这世界上判断力最强的一批人，大多不是生成者——乐评人不写曲子，编辑不写书，策展人不画画，导演不自己扛摄影机。他们凭什么比创作者更会判断好坏？凭的是他们判断了海量的别人的作品，练出的是\"鉴别\"这一种肌肉，而不是\"生产\"那一种。判断力和生成力，是两条可以分开练的线路。 所以你那句\"不亲自动手生成，连该选哪个都选不准\"，是个没证据的经验断言，而且反例就在眼前：一个每天刷几百张别人画作的策展人，和一个月画十张的人比，谁更能挑出那张好的？大概率是前者。 再退一步说，你说 AI 让人\"只需要点头或摇头\"。可真实使用 AI 的人不是这样——他是提出方向、给条件、看结果、不满意再改、再推翻。这一整套\"试、错、折返\"并没有被抽走，它只是换了个速度发生。被抽走的，只有\"把坏结果亲手做出来\"这个环节；而判断它坏不坏、要不要改，这个环节还在，甚至被要求得更紧了——因为现在你的判断要跑得过机器生成的速度。 真正会退化的，是那些本来就打算什么都不想、直接收下第一个结果的人。可那种人，在 AI 之前也不会有什么创造力。",
      "marker": "所以",
      "status": "public_claim"
    },
    {
      "speaker": "B",
      "text": "你说\"试错没被抽走，只是换了个速度\"。这句话其实把我要的论证自己递过来了——问题恰恰就出在\"速度\"上，不在次数上。 判断力不是靠\"试得够多\"长出来的，是靠\"错的代价\"长出来的。你亲手写坏一版，改了三天，最后发现这条路根本不通，这个\"通不通\"的结论才刻进你脑子里。当折返变得零延迟、零成本，你三秒钟就试了下一条路，前一秒那个错还没来得及疼，就已经被你忘了。试错还在，但试错的教训没有了。你要的肌肉是\"吃过亏之后的那点手感\"，不是\"翻页翻得快\"。 至于你举的乐评人、编辑、策展人——他们确实不生成，但他们的鉴别力是在一个前提上练出来的：有人源源不断地生成新鲜、粗糙、会出错的东西给他们鉴。他们的\"第二条线\"，靠\"第一条线\"活着。如果人人都只做点头摇头的决策者，谁来生成那些值得被鉴别的、真正新的东西？鉴别的对象先没了，鉴别这条肌肉也就没了饲料。 所以不是\"判断力和生成力可以分开练\"这么干净——是生成这条线一旦被外包，鉴别这条线也跟着饿死。",
      "marker": "所以",
      "status": "public_claim"
    }
  ],
  "evidence": [],
  "causal_chains": [
    {
      "speaker": "A",
      "text_excerpt": "我的核心判断是：AI 并不会降低人的创造力，反而会抬高创造的下限，把人从重复劳动里解放出来，让真正的创造力——也就是提出新问题、做出新取舍、承担审美与价值判断的那部分——变得更稀缺、也更值钱。 我愿意被抓住的一点是：创造力从来不是\"一个人从零凭空生成\"的东西，它始终依赖工具和既有材料。AI 只是把这种依赖变得更快、更便宜，它没有改变\"选择比生成更接近创造\"这个根本结构。 所以如果 AI 真的在降低什么，降低的也只是那些本来就不算创造的\""
    },
    {
      "speaker": "A",
      "text_excerpt": "你把我说的\"生成\"悄悄换成了\"判断力的唯一来源\"。这一换，整条因果链就靠它撑着了，但它撑不住。 判断力不是只能从\"自己亲手生成\"里长出来。恰恰相反，这世界上判断力最强的一批人，大多不是生成者——乐评人不写曲子，编辑不写书，策展人不画画，导演不自己扛摄影机。他们凭什么比创作者更会判断好坏？凭的是他们判断了海量的别人的作品，练出的是\"鉴别\"这一种肌肉，而不是\"生产\"那一种。判断力和生成力，是两条可以分开练的线路。 所以你那句\"不亲自动手生成"
    },
    {
      "speaker": "B",
      "text_excerpt": "你说\"试错没被抽走，只是换了个速度\"。这句话其实把我要的论证自己递过来了——问题恰恰就出在\"速度\"上，不在次数上。 判断力不是靠\"试得够多\"长出来的，是靠\"错的代价\"长出来的。你亲手写坏一版，改了三天，最后发现这条路根本不通，这个\"通不通\"的结论才刻进你脑子里。当折返变得零延迟、零成本，你三秒钟就试了下一条路，前一秒那个错还没来得及疼，就已经被你忘了。试错还在，但试错的教训没有了。你要的肌肉是\"吃过亏之后的那点手感\"，不是\"翻页翻得快\""
    }
  ],
  "counterexamples": [
    {
      "speaker": "A",
      "text_excerpt": "你把我说的\"生成\"悄悄换成了\"判断力的唯一来源\"。这一换，整条因果链就靠它撑着了，但它撑不住。 判断力不是只能从\"自己亲手生成\"里长出来。恰恰相反，这世界上判断力最强的一批人，大多不是生成者——乐评人不写曲子，编辑不写书，策展人不画画，导演不自己扛摄影机。他们凭什么比创作者更会判断好坏？凭的是他们判断了海量的别人的作品，练出的是\"鉴别\"这一种肌肉，而不是\"生产\"那一种。判断力和生成力，是两条可以分开练的线路。 所以你那句\"不亲自动手生成"
    }
  ],
  "boundaries": [
    {
      "speaker": "A",
      "text_excerpt": "你把我说的\"生成\"悄悄换成了\"判断力的唯一来源\"。这一换，整条因果链就靠它撑着了，但它撑不住。 判断力不是只能从\"自己亲手生成\"里长出来。恰恰相反，这世界上判断力最强的一批人，大多不是生成者——乐评人不写曲子，编辑不写书，策展人不画画，导演不自己扛摄影机。他们凭什么比创作者更会判断好坏？凭的是他们判断了海量的别人的作品，练出的是\"鉴别\"这一种肌肉，而不是\"生产\"那一种。判断力和生成力，是两条可以分开练的线路。 所以你那句\"不亲自动手生成",
      "status": "public_boundary"
    }
  ],
  "burden_of_proof": [
    {
      "speaker": "A",
      "text_excerpt": "你把我说的\"生成\"悄悄换成了\"判断力的唯一来源\"。这一换，整条因果链就靠它撑着了，但它撑不住。 判断力不是只能从\"自己亲手生成\"里长出来。恰恰相反，这世界上判断力最强的一批人，大多不是生成者——乐评人不写曲子，编辑不写书，策展人不画画，导演不自己扛摄影机。他们凭什么比创作者更会判断好坏？凭的是他们判断了海量的别人的作品，练出的是\"鉴别\"这一种肌肉，而不是\"生产\"那一种。判断力和生成力，是两条可以分开练的线路。 所以你那句\"不亲自动手生成"
    }
  ],
  "open_questions": [
    {
      "speaker": "B",
      "text_excerpt": "你最后那句话其实比你想的更有杀伤力，只是方向反了。 你说\"选择比生成更接近创造\"，又说 AI 只是让\"生成\"更快更便宜。那我顺着问一句：人做选择的能力，是从哪练出来的？不是凭空来的，是你在一次次亲自生成、亲自写坏、亲自画砸、亲自走进死胡同又折返的过程里，慢慢长出对好坏的那点判断力的。你省掉的那部分，你管它叫\"机械填充\"，但生成的过程从来不只是填充——它同时是训练你判断力的那个练习场。 工具和 AI 的区别恰恰在这里。笔、画布、软件，都要"
    },
    {
      "speaker": "A",
      "text_excerpt": "你把我说的\"生成\"悄悄换成了\"判断力的唯一来源\"。这一换，整条因果链就靠它撑着了，但它撑不住。 判断力不是只能从\"自己亲手生成\"里长出来。恰恰相反，这世界上判断力最强的一批人，大多不是生成者——乐评人不写曲子，编辑不写书，策展人不画画，导演不自己扛摄影机。他们凭什么比创作者更会判断好坏？凭的是他们判断了海量的别人的作品，练出的是\"鉴别\"这一种肌肉，而不是\"生产\"那一种。判断力和生成力，是两条可以分开练的线路。 所以你那句\"不亲自动手生成"
    },
    {
      "speaker": "B",
      "text_excerpt": "你说\"试错没被抽走，只是换了个速度\"。这句话其实把我要的论证自己递过来了——问题恰恰就出在\"速度\"上，不在次数上。 判断力不是靠\"试得够多\"长出来的，是靠\"错的代价\"长出来的。你亲手写坏一版，改了三天，最后发现这条路根本不通，这个\"通不通\"的结论才刻进你脑子里。当折返变得零延迟、零成本，你三秒钟就试了下一条路，前一秒那个错还没来得及疼，就已经被你忘了。试错还在，但试错的教训没有了。你要的肌肉是\"吃过亏之后的那点手感\"，不是\"翻页翻得快\""
    }
  ],
  "attack_routes": [
    {
      "owner": "A",
      "text_excerpt": "我的核心判断是：AI 并不会降低人的创造力，反而会抬高创造的下限，把人从重复劳动里解放出来，让真正的创造力——也就是提出新问题、做出新取舍、承担审美与价值判断的那部分——变得更稀缺、也更值钱。 我愿意被抓住的一点是：创造力从来不是\"一个人从零凭空生成\"的东西，它始终依赖工具和既有材料。AI 只是把这种依赖变得更快、更便宜，它没有改变\"选择比生成更接近创造\"这个根本结构。 所以如果 AI 真的在降低什么，降低的也只是那些本来就不算创造的\"",
      "route_key": "counterexample"
    },
    {
      "owner": "B",
      "text_excerpt": "你最后那句话其实比你想的更有杀伤力，只是方向反了。 你说\"选择比生成更接近创造\"，又说 AI 只是让\"生成\"更快更便宜。那我顺着问一句：人做选择的能力，是从哪练出来的？不是凭空来的，是你在一次次亲自生成、亲自写坏、亲自画砸、亲自走进死胡同又折返的过程里，慢慢长出对好坏的那点判断力的。你省掉的那部分，你管它叫\"机械填充\"，但生成的过程从来不只是填充——它同时是训练你判断力的那个练习场。 工具和 AI 的区别恰恰在这里。笔、画布、软件，都要",
      "route_key": "general"
    },
    {
      "owner": "A",
      "text_excerpt": "你把我说的\"生成\"悄悄换成了\"判断力的唯一来源\"。这一换，整条因果链就靠它撑着了，但它撑不住。 判断力不是只能从\"自己亲手生成\"里长出来。恰恰相反，这世界上判断力最强的一批人，大多不是生成者——乐评人不写曲子，编辑不写书，策展人不画画，导演不自己扛摄影机。他们凭什么比创作者更会判断好坏？凭的是他们判断了海量的别人的作品，练出的是\"鉴别\"这一种肌肉，而不是\"生产\"那一种。判断力和生成力，是两条可以分开练的线路。 所以你那句\"不亲自动手生成",
      "route_key": "scope"
    },
    {
      "owner": "B",
      "text_excerpt": "你说\"试错没被抽走，只是换了个速度\"。这句话其实把我要的论证自己递过来了——问题恰恰就出在\"速度\"上，不在次数上。 判断力不是靠\"试得够多\"长出来的，是靠\"错的代价\"长出来的。你亲手写坏一版，改了三天，最后发现这条路根本不通，这个\"通不通\"的结论才刻进你脑子里。当折返变得零延迟、零成本，你三秒钟就试了下一条路，前一秒那个错还没来得及疼，就已经被你忘了。试错还在，但试错的教训没有了。你要的肌肉是\"吃过亏之后的那点手感\"，不是\"翻页翻得快\"",
      "route_key": "scope"
    }
  ],
  "defense_routes": [],
  "strategic_state": {
    "initiative": "B",
    "core_conclusion_stability": {
      "A": 0.5,
      "B": 0.5
    },
    "future_choice_space": {
      "A": 1.0,
      "B": 1.0
    },
    "recent_information_increment": [],
    "termination_observation_window": 0,
    "last_attack_value": {
      "A": 1.0,
      "B": 0.8
    },
    "turn_pressure": {
      "A": 0.0,
      "B": 0.0
    }
  },
  "inquiry_ledger": {
    "valid_units": 0,
    "A_initiated": 0,
    "B_initiated": 0,
    "units": [],
    "used_attack_operators": [],
    "core_routes": []
  }
}